Quote	Notes
Artificial intelligence is nowhere near attaining actual sentience or awareness. And without awareness it’s simply a mechanical device, which may pretend to show emotions and sentience, if it is programmed to do so, and thus it may be able to fool the humans as being alive, but in its own internal circuitry, it’d simply be following its preprogrammed tasks through the flowchart of an algorithm.   -- Abhijit Naskar	https://www.goodreads.com/quotes/tag/computer-science
Artificial intelligence will not destroy this planet, irresponsible human intelligence will.   -- Abhijit Naskar	https://www.goodreads.com/quotes/tag/computer-science
Automation vs. human labor is a false dichotomy   -- Siddharth Suri, Ghost Work: How to Stop Silicon Valley from Building a New Global Underclass	https://www.goodreads.com/quotes/tag/computer-science
believe the power of jQuery is highly underutilized. Most developers will take advantage of its shortcuts and CSS selectors, but most of the time they fail to take advantage of much else. Being able to extend jQuery, whether by adding your own functions, CSS selectors or full-blown plugins, makes you a much stronger and smarter developer.   -- Robert Duchnik, jQuery Plugin Development In 30 Minutes	https://www.goodreads.com/quotes/tag/computer-science
Bombe atomique hier, bombe informatique aujourd'hui et, demain, bombe génétique?   -- Paul Virilio	https://www.goodreads.com/quotes/tag/computer-science
C is quirky, flawed, and an enormous success.   -- Dennis M. Ritchie	https://www.goodreads.com/quotes/tag/computer-science
Ciência da Computação tem tanto a ver com o computador como a astronomia com o telescópio, a biologia com o microscópio, ou a química com os tubos de ensaio. A ciência não estuda ferramentas, mas o que fazemos e o que descobrimos com elas.   -- Edsger Dijkstra	https://www.goodreads.com/quotes/tag/computer-science
Code is not like other how-computers-work books. It doesn't have big color illustrations of disk drives with arrows showing how the data sweeps into the computer. Code has no drawings of trains carrying a cargo of zeros and ones. Metaphors and similes are wonderful literary devices but they do nothing but obscure the beauty of technology.   -- Charles Petzold, Code: The Hidden Language of Computer Hardware and Software	https://www.goodreads.com/quotes/tag/computer-science
Coding is not just code, that is a live thing to serve everyone!   -- Ming Song	https://www.goodreads.com/quotes/tag/computer-science
Computation is not the same as thought and emulation is not the same as imagination.   -- Abhijit Naskar, Mission Reality	https://www.goodreads.com/quotes/tag/computer-science
Computer science increasingly relies on its private corporate patrons who apply their own closed systems of peer review and criticism, with occasional results thrown over the wall. The closed walls of Redmond or Mountain View enable old-fashioned patronage of nature's secrets. The objectivity and scientific status of computer science is a chimera: we cannot stand on the shoulders of giants in computer science, for they simply refuse to let us.   -- Samir Chopra, Decoding Liberation: The Promise of Free and Open Source Software	https://www.goodreads.com/quotes/tag/computer-science
Computer science only indicates the retrospective omnipotence of our technologies. In other words, an infinite capacity to process data (but only data - i.e. the already given) and in no sense a new vision. With that science, we are entering an era of exhaustivity, which is also an era of exhaustion. Of generalized interactivity abolishing particularized action. Of the interface which abolishes challenge, passion, and rivalry between peoples, ideas and individuals which was always the source of the finest energies.	https://www.goodreads.com/quotes/tag/computer-science
Computers and mobile devices are becoming known for their inherent insecurities and the ability to damage the long term health of the users.   -- Steven Magee	https://www.goodreads.com/quotes/tag/computer-science
Discoveries can come in many different ways, and the most important thing is to be ready for them.   -- Neil C. Jones, An Introduction to Bioinformatics Algorithms	https://www.goodreads.com/quotes/tag/computer-science
El desarrollo de software comparte con el deporte profesional la característica de lograr que los treintañeros se sientan decrépitos   -- Neal Stephenson, Snow Crash	https://www.goodreads.com/quotes/tag/computer-science
El hecho es que el ordenador está aquí para quedarse y los niños saben utilizarlo y nosotros no. Incluso el lenguaje.   -- Tom Sharpe, Wilt On High	https://www.goodreads.com/quotes/tag/computer-science
End-to-End encryption is practically a meaningless phrase used by internet-based companies to coax people into believing the modern myth of online privacy.   -- Abhijit Naskar	https://www.goodreads.com/quotes/tag/computer-science
Every machine has artificial intelligence. And the more advanced a machine gets, the more advanced artificial intelligence gets as well. But, a machine cannot feel what it is doing. It only follows instructions - our instructions - instructions of the humans. So, artificial intelligence will not destroy the world. Our irresponsibility will destroy the world.   -- Abhijit Naskar	https://www.goodreads.com/quotes/tag/computer-science
Evolution optimizes strongly for energy efficiency because of limited food supply, not for ease of construction or understanding by human engineers.   -- Max Tegmark	https://www.goodreads.com/quotes/tag/computer-science
For many purposes, we need to understand the world as having things in it that are related to each other, not just variables with values. For example, we might notice that a large truck ahead of us is reversing into the driveway of a dairy farm but a cow has got loose and is blocking the truck’s path. A factored representation is unlikely to be pre-equipped with the attribute TruckAheadBackingIntoDairyFarmDrivewayBlockedByLooseCow with value true or false   -- Stuart Russell, Artificial Intelligence: A Modern Approach	https://www.goodreads.com/quotes/tag/computer-science
Functions that create values are easier to combine in new ways than functions that directly perform side effects   -- Marijn Haverbeke	https://www.goodreads.com/quotes/tag/computer-science
Generating a system architecture is not a deterministic process. It requires careful consideration of business requirements, technology choices, existing infrastructure and systems, and actual physical resources, such as budget and manpower.   -- Andrew Holdsworth, Oracle9i Database Performance Planning	https://www.goodreads.com/quotes/tag/computer-science
I don't know how many of you have ever met Dijkstra, but you probably know that arrogance in computer science is measured in nano-Dijkstras.   -- Alan Kay	https://www.goodreads.com/quotes/tag/computer-science
I got more interested in the calculator than I did in the problem.   -- Fernando Corbató	https://www.goodreads.com/quotes/tag/computer-science
I heard reiteration of the following claim: Complex theories do not work; simple algorithms do.	https://www.goodreads.com/quotes/tag/computer-science
I heard reiteration of the following claim: Complex theories do not work; simple algorithms do.	https://www.goodreads.com/quotes/tag/computer-science
I hope the ﬁeld of computer science never loses its sense of fun. ... What you know about computing other people will learn. Don’t feel as if the key to successful computing is only in your hands. What’s in your hands I think and hope is intelligence: the ability to see the machine as more than when you were ﬁrst led up to it, that you can make it more.   -- Alan J. Perlis, Structure and Interpretation of Computer Programs	https://www.goodreads.com/quotes/tag/computer-science
I think that it’s extraordinarily important that we in computer science keep fun in computing. When it started out it was an awful lot of fun. Of course the paying customers got shafted every now and then and after a while we began to take their complaints seriously. We began to feel as if we really were responsible for the successful error-free perfect use of these machines. I don’t think we are. I think we’re responsible for stretching them setting them off in new directions and keeping fun in the house. I hope the ﬁeld of computer science never loses its sense of fun. Above all I hope we don’t become missionaries. Don’t feel as if you’re Bible sales-men. The world has too many of those already. What you know about computing other people will learn. Don’t feel as if the key to successful computing is only in your hands. What’s in your hands I think and hope is intelligence: the ability to see the machine as more than when you were ﬁrst led up	https://www.goodreads.com/quotes/tag/computer-science
I was transformed...because I caught a glimpse of a revolutionary use for computers. We seized the opportunity to the computer as a general processor for symbols (hence thoughts) rather than just a speedy engine for arithmetic.   -- Herbert A. Simon, Models of My Life	https://www.goodreads.com/quotes/tag/computer-science
I wish to add my mite towards expounding & interpreting the Almighty, & his laws & works, for the most effective use of mankind; and certainly, I should feel it no small glory if I were enabled to be one of his most noted prophets (using this word in my own peculiar sense) in this world.   -- Ada Lovelace, Ada, the Enchantress of Numbers: A Selection from the Letters of Lord Byron's Daughter and Her Description of the First Computer	https://www.goodreads.com/quotes/tag/computer-science
I would like to demonstrate that in the area of science a good old principle is valid:	https://www.goodreads.com/quotes/tag/computer-science
I’m glad someone’s finally giving ed the attention it deserves.   --  Ken Thompson	https://www.goodreads.com/quotes/tag/computer-science
Ich langte in meine Tasche nach einem Milky Way - was sonst für einen Astronomen - und machte es mir bequem, um den Hacker auf meinem grünen Monitor zu beobachten.   -- Clifford Stoll, The Cuckoo's Egg: Tracking a Spy Through the Maze of Computer Espionage	https://www.goodreads.com/quotes/tag/computer-science
If a machine ever gains awareness, it will be not due to our careful programming, but due to an unforeseeable anomaly.   -- Abhijit Naskar, The Gospel of Technology	https://www.goodreads.com/quotes/tag/computer-science
If the brain had a native language we would be able to communicate with all humans without translation. Or even all other creatures on earth.   -- Ghassan Labban	https://www.goodreads.com/quotes/tag/computer-science
If you are too lazy to cleanup your database after testing, your filesystem after testing or your memory based system consider moving to a different profession. This isn't a job for you.   -- Roy Osherove, The Art of Unit Testing: With Examples in .NET	https://www.goodreads.com/quotes/tag/computer-science
Il fattore umano è l'anello più debole della sicurezza   -- Kevin D. Mitnick, The Art of Deception: Controlling the Human Element of Security	https://www.goodreads.com/quotes/tag/computer-science
In my experience, requirements change quite often, or new situations will arise that weren’t anticipated at the start of the project. If the situation can be addressed with a plugin, I just whip open the standalone plugin page, make the updates and pop the new plugin back in. Because the plugin is self-contained, it’s easy to recreate the problem, fix it, and get it back into the codebase.   -- Robert Duchnik, jQuery Plugin Development In 30 Minutes	https://www.goodreads.com/quotes/tag/computer-science
In search," Urs (Hölzle) believed, "the discussion was really, How can we outdistance our current system and make it look laughable? That's the best definition of success: if a new system comes out and everyone says, 'Wow, I can't believe we put up with that old thing because it was so primitive and limited compared to this.   -- Douglas Edwards, I'm Feeling Lucky: The Confessions of Google Employee Number 59	https://www.goodreads.com/quotes/tag/computer-science
In the end, it all comes down to 0 and 1   -- Vineet Goel	https://www.goodreads.com/quotes/tag/computer-science
In the history of ideas, it's repeatedly happened that an idea, developed in one area for one purpose, finds an unexpected application elsewhere. Concepts developed purely for philosophy of mathematics turned out to be just what you needed to build a computer. Statistical formulae for understanding genetic change in biology are now applied in both economics and in programming.   -- Patrick Grim	https://www.goodreads.com/quotes/tag/computer-science
In the U.S. there are two types of hipsters: those who know how to program and those who serve coffee.   -- César Hidalgo	https://www.goodreads.com/quotes/tag/computer-science
Index design is also a largely iterative process, based on the SQL generated by application designers. However, it is possible to make a sensible start by building indexes that enforce primary key constraints and indexes on known access patterns, such as a person's name. As the application evolves and testing is performed on realistic sizes of data, certain queries will need performance improvements for which building a better index is a good solution.   -- Andrew Holdsworth, Oracle9i Database Performance Planning	https://www.goodreads.com/quotes/tag/computer-science
Is it possible that software is not like anything else, that it is meant to be discarded: that the whole point is to always see it as a soap bubble?   -- Alan J Perlis	https://www.goodreads.com/quotes/tag/computer-science
It can be argued that the computer is humanity’s attempt to replicate the human brain. This is perhaps an unattainable goal. However, unattainable goals often lead to outstanding accomplishment.   -- Ammaar Shaukat Reshi	https://www.goodreads.com/quotes/tag/computer-science
It can be argued that the computer is humanity’s attempt to replicate the human brain. This is perhaps an unattainable goal. However, unattainable goals often lead to outstanding accomplishment.   -- Zubair Saleem Fazal	https://www.goodreads.com/quotes/tag/computer-science
It is difficult to find a remedy for our own sadness, because we are ourselves implicated in it. It is difficult to find a remedy for other people's sadness because we are prisoners of it.   -- Jean Baudrillard, Cool Memories	https://www.goodreads.com/quotes/tag/computer-science
It is possible to invent a single machine which can be used to compute any computable sequence.   -- Alan Turing	https://www.goodreads.com/quotes/tag/computer-science
jQuery is by far the most widely used library for JavaScript. It is used on more than 50% of websites. Many frameworks, such as Backbone and Twitter’s Bootstrap, are built on top of jQuery. Being able to extend and write plugins for jQuery can not only save lots of time, but also makes code much cleaner and easier to maintain.   -- Robert Duchnik, jQuery Plugin Development In 30 Minutes	https://www.goodreads.com/quotes/tag/computer-science
Just as functions within computer science, ecosystems must become first-class citizens in biology. First-class functions are not merely sequences of steps, but genuine entities, which can be passed as arguments to and from other functions in the same manner as other data types. Languages that support this concept have a fundamentally greater expressive power than those that relegate functions to the status of 'second-class citizens' relative to first-class 'data' objects. Biology needs an analogous expressive power in order to refer properly to the role of ecosystems as carriers of fundamental patterns, and as entities parallel to and in some ways superseding organisms.   -- Eric Smith, The Origin and Nature of Life on Earth: The Emergence of the Fourth Geosphere	https://www.goodreads.com/quotes/tag/computer-science
Lilah did little more than sleep and eat and cry, which to me was the most fascinating thing in the entire universe. Why did she cry? When did she sleep? What made her eat a lot one day and little the next? Was she changing with time? I did what any obsessed person would do in such a case: I recorded data, plotted it, calculated statistical correlations. First I just wrote on scraps of paper and made charts on graph paper, but I very quickly became more sophisticated. I wrote computer software to make a beautifully colored plot showing times when Diane fed Lilah, in black; when I fed her, in blue (expressed mother's milk, if you must know); Lilah's fussy times, in angry red; her happy times, in green. I calculated patterns in sleeping times, eating times, length of sleep, amounts eaten.	https://www.goodreads.com/quotes/tag/computer-science
loop { work(); play(); ; // <-- empty statement } Rust follows the tradition of C in allowing this. Empty statements do nothing except convey a slight feeling of melancholy. We mention them only for completeness.   -- Jim Blandy, Jason Orendorff, Programming Rust: Fast, Safe Systems Development	https://www.goodreads.com/quotes/tag/computer-science
Loving what you do, doing what you love   -- Randall Hyde, Write Great Code, Volume 3: Engineering Software	https://www.goodreads.com/quotes/tag/computer-science
Machine learning, in the simplest terms, is the analysis of statistics to help computers make decisions base on repeatable characteristics found in the data.   -- Vardhan Kishore Agrawal	https://www.goodreads.com/quotes/tag/computer-science
Most improved things can be improved.   -- Mokokoma Mokhonoana	https://www.goodreads.com/quotes/tag/computer-science
No matter which field of work you want to go in, it is of great importance to learn at least one programming language.   -- Ram Ray	https://www.goodreads.com/quotes/tag/computer-science
No program can say what another will do. Now, I won’t just assert that, I’ll prove it to you. I will prove that although you might work till you drop, You cannot tell if computation will stop.   -- Geoffrey K. Pullum	https://www.goodreads.com/quotes/tag/computer-science
No technology that's connected to the internet is unhackable.   -- Abhijit Naskar, The Gospel of Technology	https://www.goodreads.com/quotes/tag/computer-science
Nothing is more practical than a good theory.   -- Vladimir N Vapnik	https://www.goodreads.com/quotes/tag/computer-science
Nothing is more practical than a good theory.   -- Vladimir N Vapnik	https://www.goodreads.com/quotes/tag/computer-science
One of the goals of this book is to show that, at least in the problems of statistical inference, this is not true. I would like to demonstrate that in the area of science a good old principle is valid:	https://www.goodreads.com/quotes/tag/computer-science
Overstimulation has been the real drawback. I need to find ways to stop thinking about analysis of algorithms, in order to do various other things that human beings ought to do.   -- Donald Ervin Knuth, Selected Papers on Computer Science	https://www.goodreads.com/quotes/tag/computer-science
Pascal is for building pyramids -- imposing, breathtaking, static structures built by armies pushing heavy blocks into place. Lisp is for building organisms -- imposing, breathtaking, dynamic structures built by squads fitting fluctuating myriads of simpler organisms into place.   -- Harold Abelson; Gerald Jay Sussman; Julie Sussman; Eiichi Wada	https://www.goodreads.com/quotes/tag/computer-science
Perhaps the most important principle for the good algorithm designer is to refuse to be content.   -- Alfred V. Aho	https://www.goodreads.com/quotes/tag/computer-science
Programming in machine code is like eating with a toothpick.   -- Charles Petzold, Code: The Hidden Language of Computer Hardware and Software	https://www.goodreads.com/quotes/tag/computer-science
Programs should always have the form of paragraphs of comments that describe the intention of the program followed by paragraphs of code that implement that intention. All of the formatting should be designed to make readers as able as possible to read the code easily; the compiler doesn’t care. In particular, follow conventions of mathematics and your native language, not those you found in some random language manual. Write the comments first and then write the code, not the other way around. If you don’t know what you want to achieve and why, any code you write is, by definition, incorrect.   -- Charles Wetherell, Etudes for Programmers	https://www.goodreads.com/quotes/tag/computer-science
Q: Why bother doing proofs about programming languages? They are almost always boring if the definitions are right.  A: The definitions are almost always wrong.  - Anonymous   -- Benjamin C. Pierce	https://www.goodreads.com/quotes/tag/computer-science
religious beliefs, especially if those beliefs are strongly held. Further, scientists have hopes, standards, and ethical beliefs, and they—like anybody—are not eager to find that their beliefs are invalid.   -- James Kennedy, Swarm Intelligence	https://www.goodreads.com/quotes/tag/computer-science
Reusability is key in reducing bugs and coding quickly. The more I use a piece of code, the more confident and familiar I become with it, which in turn significantly speeds up my development time.   -- Robert Duchnik, jQuery Plugin Development In 30 Minutes	https://www.goodreads.com/quotes/tag/computer-science
Seemingly innocuous language like 'Oh, I'm flexible' or 'What do you want to do tonight?' has a dark computational underbelly that should make you think twice. It has the veneer of kindness about it, but it does two deeply alarming things. First, it passes the cognitive buck: 'Here's a problem, you handle it.' Second, by not stating your preferences, it invites the others to simulate or imagine them. And as we have seen, the simulation of the minds of others is one of the biggest computational challenges a mind (or machine) can ever face.   -- Brian Christian, Algorithms to Live By: The Computer Science of Human Decisions	https://www.goodreads.com/quotes/tag/computer-science
Simple things should be simple, complex things should be possible.   -- Alan Kay	https://www.goodreads.com/quotes/tag/computer-science
Simply In Depth......   -- Ajit Singh	https://www.goodreads.com/quotes/tag/computer-science
Software is like entropy: It is difficult to grasp, weighs nothing, and obeys the Second Law of Thermodynamics; i.e., it always increases.   -- Norman Augustine	https://www.goodreads.com/quotes/tag/computer-science
Spreadsheets are more important to marketing than pretty pictures these days.   -- Trevor Carss	https://www.goodreads.com/quotes/tag/computer-science
Stop pushing people into web development as if it is the only true career path. Instead, push people into computer science, programming, coding, etc. There is so much competition because everyone is doing it, you just create a lot of demoralized and disgruntled people. There is more to programming than web development.   -- Olawale Daniel	https://www.goodreads.com/quotes/tag/computer-science
Suppose whatever we can recognize we can find. We can if P=NP.   -- Lance Fortnow, The Golden Ticket: P, Np, and the Search for the Impossible	https://www.goodreads.com/quotes/tag/computer-science
Tests are stories we tell the next generation of programmers on a project.   -- Roy Osherove, The Art of Unit Testing: With Examples in .NET	https://www.goodreads.com/quotes/tag/computer-science
The advantage of subdividing the heap is that multiple threads can each allocate objects at the same time without interfering with one another. Further, by allocating object used by the same thread from the same memory region, cache hit rates may improve.   -- Thomas Anderson, Operating Systems: Principles and Practice	https://www.goodreads.com/quotes/tag/computer-science
The Analytical Engine has no pretensions whatever to originate anything. It can do whatever we know how to order it to perform.   -- Ada Lovelace	https://www.goodreads.com/quotes/tag/computer-science
The best programs are written so that computing machines can perform them quickly and so that human beings can understand them clearly. A programmer is ideally an essayist who works with traditional aesthetic and literary forms as well as mathematical concepts, to communicate the way that an algorithm works and to convince a reader that the results will be correct.   -- Donald E. Knuth, Selected Papers on Computer Science	https://www.goodreads.com/quotes/tag/computer-science
The business we're in is more sociological than technological, more dependent on workers' abilities to communicate with each other than their abilities to communicate with machines.   -- Tom DeMarco, Peopleware: Productive Projects and Teams	https://www.goodreads.com/quotes/tag/computer-science
