Quote	Notes
The clarity offered by software as metaphor - and the empowerment allegedly offered to us who know software - should make us pause, because software also engenders a sense of profound ignorance. Software is extremely difficult to comprehend. Who really knows what lurks behind our smiling interfaces, behind the objects we click and manipulate? Who completely understands what one’s computer is actually doing at any given moment? Software as a metaphor for metaphor troubles the usual functioning of metaphor, that is, the clarification of an unknown concept through a known one. For, if software illuminates an unknown, it does so through an unknowable (software). This paradox - this drive to grasp what we do not know through what we do not entirely understand… does not undermine, but rather grounds software’s appeal. Its combination of what can be seen and not seen, can be known and no known - it’s separation of interface from algorithm, of software from hardware - makes it a powerful metaphor for everything we believe is invisible yet generates visible effects, from genetics to the invisible hand of the market, from ideology to culture. Every use entails an act of faith.   -- Wendy Hui Kyong Chun, Programmed Visions: Software and Memory 	https://www.goodreads.com/quotes/tag/computer-science
The component structure cannot be designed from the top down. It is not one of the first things about the system that is designed, but rather evolves as the system grows and changes.   -- Robert C. Martin, Clean Architecture	https://www.goodreads.com/quotes/tag/computer-science
The computer only gives back ourselves. It is a faithful mirror that reflects the human traits that are brought to it.   -- William Barrett, The Illusion of Technique: A Search for Meaning in a Technological Civilization	https://www.goodreads.com/quotes/tag/computer-science
The computing scientist’s main challenge is not to get confused by the complexities of his own making.   -- Edsger W. Dijkstra	https://www.goodreads.com/quotes/tag/computer-science
The cost of electrons and photons is getting cheaper all the time!   -- T. Gilling, The STREAM TONE: The Future of Personal Computing?	https://www.goodreads.com/quotes/tag/computer-science
The DQN AI system of Google DeepMind can accomplish a slightly broader range of goals: it can play dozens of different vintage Atari computer games at human level or better. In contrast, human intelligence is thus far uniquely broad, able to master a dazzling panoply of skills.	https://www.goodreads.com/quotes/tag/computer-science
The great paradox of automation is that the desire to eliminate human labor always generates new tasks for humans.   -- Mary L. Gray, Ghost Work: How to Stop Silicon Valley from Building a New Global Underclass	https://www.goodreads.com/quotes/tag/computer-science
The ocean is a Turing machine, the sand is its tape; the water reads the marks in the sand and sometimes erases them and sometimes carves new ones with tiny currents that are themselves a response to the marks.   -- Neal Stephenson, Cryptonomicon	https://www.goodreads.com/quotes/tag/computer-science
The only way to make sure that you don't lose your job with the arrival of AI, is to do something that AI cannot do, and the only thing that artificial intelligence cannot do but a human can, is being original. So, do something original and no AI can ever replace you.   -- Abhijit Naskar	https://www.goodreads.com/quotes/tag/computer-science
The original Ethernet consisted of a fat cable into which a wire coming from each computer was forcibly inserted using what was euphemistically referred to a vampire tap.   -- Andrew Tanenbaum	https://www.goodreads.com/quotes/tag/computer-science
The pipeline assumes a passive flow of women (and men) from one stage to the next culminating in a scientific career.   -- Enobong Hannah Branch, Pathways, Potholes, and the Persistence of Women in Science: Reconsidering the Pipeline	https://www.goodreads.com/quotes/tag/computer-science
The question of whether a computer can think is no more interesting than the question of whether a submarine can swim.   -- Edsger W. Dijkstra	https://www.goodreads.com/quotes/tag/computer-science
The silicon microchips themselves might be cheap (relative to times past, anyway), but CPU cycles are not cheap. Every CPU cycle consumes clock time. Clock time is latency. A wasteful application makes its users wait longer than they need to, and if there’s anything users hate, it’s waiting. For web systems, latency in the application has a dual effect. The added processing directly increases the burden on the application servers themselves. Suppose that an application takes just 250 milliseconds of extra processing per transaction. If the system processes a million transactions a day, that extra 250 milliseconds per transaction makes for an extra 69.4 hours of compute time every day. Assuming an 80% load factor on each server, you’ll need four additional servers to handle this load.   -- Michael T. Nygard, Release It!: Design and Deploy Production-Ready Software	https://www.goodreads.com/quotes/tag/computer-science
The spectacle's instruction and the spectators' ignorance are wrongly seen as antagonistic factors when in fact they give birth to each other. In the same way, the computer's binary language is an irresistible inducement to the continual and unreserved acceptance of what has been programmed according to the wishes of someone else and passes for the timeless source of a superior, impartial and total logic. Such progress, such speed, such breadth of vocabulary! Political? Social? Make your choice. You cannot have both. My own choice is inescapable. They are jeering at us, and we know whom these programs are for. Thus it is hardly surprising that children should enthusiastically start their education at an early age with the Absolute Knowledge of computer science; while they are still unable to read, for reading demands making judgements at every line; and is the only access to the wealth of pre-spectacular human experience. Conversation is almost dead, and soon so too will be those who knew how to speak.   -- Guy Debord, Comments on the Society of the Spectacle	https://www.goodreads.com/quotes/tag/computer-science
The string is a stark data structure and everywhere it is passed there is much duplication of process. It is a perfect vehicle for hiding information.   -- Alan J. Perlis	https://www.goodreads.com/quotes/tag/computer-science
The very last stage of any memory hierarchy is necessarily the outside world—that is, the outside world as far as the machine is concerned, i.e. that part of it with which the machine can directly communicate, in other words, the input and the output organs of the machine. These are usually punched paper tapes or cards, and on the output side, of course, also printed paper.   -- John von Neumann, The Computer and the Brain	https://www.goodreads.com/quotes/tag/computer-science
Then, I did what any obsessed person would do these days; I put it all on the Web.   -- Mike Brown, How I Killed Pluto and Why It Had It Coming	https://www.goodreads.com/quotes/tag/computer-science
There are 2 hard problems in computer science: cache invalidation, naming things, and off-by-1 errors.   -- Leon Bambrick	https://www.goodreads.com/quotes/tag/computer-science
Thinking about small things every day from today will lead you to rise to the ranks of Donald Knuth and Alan Turing in a few years.   -- Aditya Chatterjee, How to read a Computer Science Research paper?	https://www.goodreads.com/quotes/tag/computer-science
This relation of program to environment opened up an exceedingly important role for computer simulation as a tool for achieving a deeper understanding of human behavior. For if it is the organization of components, and not their physical properties, that largely determines behavior, and if computers are organized somewhat in the image of man, then the computer becomes an obvious device for exploring the consequences of alternative organizational assumptions for human behavior. Psychology could move forward without awaiting the solutions by neurology of the problems of component design—however interesting and significant these components turn out to be.   -- Herbert A. Simon, The Sciences of the Artificial	https://www.goodreads.com/quotes/tag/computer-science
Ultimately, I try to think of my application’s main codebase as just stringing together various components and code from many sources. It just controls logic and flow. The real nitty-gritty is handled behind the scenes. This is why frameworks like Backbone are so important — they hide a lot of the details in the background and allow you to just focus on the flow and control of your application.   -- Robert Duchnik, jQuery Plugin Development In 30 Minutes	https://www.goodreads.com/quotes/tag/computer-science
Underlying our approach to this subject is our conviction that "computer science" is not a science and that its significance has little to do with computers. The computer revolution is a revolution in the way we think and in the way we express what we think. The essence of this change is the emergence of what might best be called procedural epistemology—the study of the structure of knowledge from an imperative point of view, as opposed to the more declarative point of view taken by classical mathematical subjects. Mathematics provides a framework for dealing precisely with notions of "what is". Computation provides a framework for dealing precisely with notions of "how to".   -- Harold Abelson, Structure and Interpretation of Computer Programs	https://www.goodreads.com/quotes/tag/computer-science
Unix is not so much a product as it is a painstakingly compiled oral history of the hacker subculture. It is our Gilgamesh epic: a living body of narrative that many people know by heart, and tell over and over again—making their own personal embellishments whenever it strikes their fancy. The bad embellishments are shouted down, the good ones picked up by others, polished, improved, and, over time, incorporated into the story. […] Thus Unix has slowly accreted around a simple kernel and acquired a kind of complexity and asymmetry about it that is organic, like the roots of a tree, or the branchings of a coronary artery. Understanding it is more like anatomy than physics.   -- Neal Stephenson	https://www.goodreads.com/quotes/tag/computer-science
Want to guarantee nasty conflicts? Take a word with multiple, fuzzy, definitions, force people to strike an agreement on it, attach large amounts of money to it, and then watch them fight about it a year or two later.   -- Michael T. Nygard, Release It!: Design and Deploy Production-Ready Software	https://www.goodreads.com/quotes/tag/computer-science
We can think of life as a self-replicating information-processing system whose information (software) determines both its behavior and the blueprints for its hardware.   -- Max Tegmark, Life 3.0: Being Human in the Age of Artificial Intelligence	https://www.goodreads.com/quotes/tag/computer-science
We will start by sketching the recursive algorithm and then add details to get to a full description of the algorithm. Footnote : Translation: We will add details till the mess becomes both undecipherable and incomprehensible at the same time. Hopefully, the inner poetical and rhythmical beauty of the text will keep the reader going.   -- Sariel Har-Peled, Geometric Approximation Algorithms	https://www.goodreads.com/quotes/tag/computer-science
Well, writing novels is incredibly simple: an author sits down…and writes. Granted, most writers I know are a bit strange. Some, downright weird.But then again, you’d have to be. To spend hundreds and hundreds of hours sitting in front of a computer screen staring at lines of information is pretty tedious. More like a computer programmer. And no matter how cool the Matrix made looking at code seem, computer programmers are even weirder than authors.   -- Christopher Hopper	https://www.goodreads.com/quotes/tag/computer-science
What one programmer can do in one month, two programmers can do in two months.   -- Fred Brooks	https://www.goodreads.com/quotes/tag/computer-science
What's in your hands I think and hope is intelligence: the ability to see the machine as more than when you were ﬁrst led up to it that you can make it more.   -- Alan J. Perlis	https://www.goodreads.com/quotes/tag/computer-science
When human beings acquired language, we learned not just how to listen but how to speak. When we gained literacy, we learned not just how to read but how to write. And as we move into an increasingly digital reality, we must learn not just how to use programs but how to make them. In the emerging highly programmed landscape ahead, you will either create the software or you will be the software. It’s really that simple: Program, or be programmed.   -- Douglas Rushkoff, Program or Be Programmed: Ten Commands for a Digital Age	https://www.goodreads.com/quotes/tag/computer-science
When the ANSI C standard was under development, the pragma directive was introduced. Borrowed from Ada, #pragma is used to convey hints to the compiler, such as the desire to expand a particular function in-line or suppress range checks. Not previously seen in C, pragma met with some initial resistance from a gcc implementor, who took the implementation-defined effect very literally—in gcc version 1.34, the use of pragma causes the compiler to stop compiling and launch a computer game instead! The gcc manual contained the following: The #pragma command is specified in the ANSI standard to have an arbitrary implementation-defined effect. In the GNU C preprocessor, #pragma first attempts to run the game rogue; if that fails, it tries to run the game hack; if that fails, it tries to run GNU Emacs displaying the Tower of Hanoi; if that fails, it reports a fatal error. In any case, preprocessing does not continue. —Manual for version 1.34 of the GNU C compiler   -- Peter van der Linden, Expert C Programming: Deep C Secrets	https://www.goodreads.com/quotes/tag/computer-science
While functions being unable to change state is good because it helps us reason about our programs, there's one problem with that. If a function can't change anything in the world, how is it supposed to tell us what it calculated? In order to tell us what it calculated, it has to change the state of an output device (usually the state of the screen), which then emits photons that travel to our brain and change the state of our mind, man.   -- Miran Lipovača	https://www.goodreads.com/quotes/tag/computer-science
why bother with null and java 8 has optional   -- Ahmad Moawad	https://www.goodreads.com/quotes/tag/computer-science
Worse yet is the rejection of upfront requirements. The basic observation is correct: requirements will change, and are hard anyway to capture at the beginning. In no way, however, does it imply the dramatic conclusion that upfront requirements are useless! What it does imply is that requirements should be subject to change, like all other artifacts on the software process. [...] The agile advice here is irresponsible and serious software projects should ignore it.The sound practice is to start collecting requirements at the beginning, produce a provisional version prior to engaging in design, and treat the requirements as a living product that undergoes constant adaptation throughout the project.   -- Bertrand Meyer	https://www.goodreads.com/quotes/tag/computer-science
You are not reading this book because a teacher assigned it to you, you are reading it because you have a desire to learn, and wanting to learn is the biggest advantage you can have.   -- Cory Althoff, The Self-Taught Programmer: The Definitive Guide to Programming Professionally	https://www.goodreads.com/quotes/tag/computer-science